{
  "status": "has_findings",
  "summary": "Re-review of scripts/codex-smoke.js found 4 material issues: the smoke test still runs Codex against the live repo, does not fail if Codex executes shell commands, ignores adapter error events from streaming parse failures, and lacks focused regression coverage for these behaviors.",
  "findings": [
    {
      "severity": "high",
      "title": "Smoke test runs the real agent against the live workspace instead of an immutable snapshot",
      "why_it_matters": "This script hands the real repository root to Codex. If the model ignores the prompt, follows prompt-injected repo content, or regresses into tool use, it can modify or inspect the developer's working tree during a smoke test. That is a real regression/security risk and contradicts the repo's own immutable-snapshot decision.",
      "file": "scripts/codex-smoke.js",
      "line": 29,
      "fix_instructions": "Replace `snapshotPath = repoRoot` with a temporary snapshot directory created from the repo contents, and run the adapter against that snapshot. Make the snapshot read-only where possible, or at minimum isolate it under a temp dir and delete it after the run. Fail the test if snapshot creation/isolation cannot be established.",
      "confidence": "high"
    },
    {
      "severity": "high",
      "title": "The test never fails if Codex executes shell commands despite the prompt explicitly forbidding them",
      "why_it_matters": "`parseCodexExecChunk()` emits `command_started` and `command_completed` status events, but this loop ignores them. A misbehaving or prompt-injected Codex run can execute commands and still end with `[]`, causing the smoke test to report PASS even though the safety contract was violated.",
      "file": "scripts/codex-smoke.js",
      "line": 43,
      "fix_instructions": "Track `status` events whose `payload.state` is `command_started` or `command_completed`. Record the command text, and after the stream ends, fail the smoke test with the captured command(s) if any command-execution event was seen.",
      "confidence": "high"
    },
    {
      "severity": "medium",
      "title": "Streaming parse failures are silently ignored by the smoke script",
      "why_it_matters": "The adapter emits `error` events when `parseChunk()` or `parseResult()` throws. This script ignores those events and only checks `result.status` plus the final message. That means the smoke test can pass while JSONL streaming is already broken, which defeats the stated goal of verifying streaming parsing behavior.",
      "file": "scripts/codex-smoke.js",
      "line": 43,
      "fix_instructions": "While consuming `stream`, collect any `event.event_type === 'error'` events. After the loop, fail immediately if any were seen, and include the error message(s) in stderr so the regression is visible.",
      "confidence": "high"
    },
    {
      "severity": "low",
      "title": "No focused regression test covers the new strict validation paths in the smoke script",
      "why_it_matters": "Round 3 changed the acceptance logic around agent-message text typing, JSON parse hard failure, and requiring an empty array. Without unit coverage, a later refactor can reintroduce false positives or false negatives and the only signal will be a flaky/manual smoke run.",
      "file": "scripts/codex-smoke.js",
      "line": null,
      "fix_instructions": "Add automated tests for the smoke-script decision logic by stubbing `adapter.execute()`. Cover at least: non-string `payload.text` must not satisfy the check, malformed JSON in the last agent message must fail, non-empty arrays must fail, command-execution events must fail, and stream `error` events must fail.",
      "confidence": "medium"
    }
  ],
  "fix_plan": [
    "Run the smoke test against an isolated temporary snapshot instead of `repoRoot`.",
    "Fail the run if any `command_started` or `command_completed` event is observed.",
    "Fail the run if any adapter `error` event is emitted while consuming the stream.",
    "Add regression tests around the strict validation branches introduced in Round 3."
  ],
  "rerun_review": true
}
